{
    "molssi_bse_schema": {
        "schema_type": "table",
        "schema_version": "0.1"
    },
    "basis_set_name": "5-21G",
    "basis_set_family": "pople",
    "basis_set_description": "5-21G valence double-zeta basis set",
    "basis_set_revision_description": "Curated",
    "basis_set_role": "orbital",
    "basis_set_auxiliaries": {},
    "basis_set_elements": {
        "3": {
            "element_entry": "pople/5-21G.0.element.json"
        },
        "4": {
            "element_entry": "pople/5-21G.0.element.json"
        }
    }
}
